{
  "schema": "durins-vault.mod/v1",
  "id": "durins-vault.example-wall",
  "name": "Example Wall",
  "version": "0.1.0",
  "game": {
    "id": "return-to-moria",
    "engine": "UE4.27"
  },
  "requires": [],
  "layers": {
    "runtime": [],
    "cooked_content": [],
    "data_tables": [],
    "research": [
      "data/discoveries/crude_wall_3x4_a.json"
    ]
  }
}
